{
  "key": "credit-chip",
  "name": "Credit chip",
  "category": "dataRecordingAndStorage",
  "costInCredits": 100,
  "weight": 0.0,
  "description": "The credit chip is a small, flat card that features a security code and algorithm memory stripes. The chip can be preloaded with a specified number of credits, or it can draw directly from a specific account held by the user. The credit chip can be accessed with a pin, or by a DC 15 slicer's kit check.",
  "stealthDisadvantage": false,
  "sourceKey": "wh",
  "contentSet": "core"
}
